link,headline,datetime_posted,content,scraped_at,analysis_result
https://doctor.ndtv.com/women-s-health/bowl-issues-during-periods-these-tips-can-help-8853026,Bowl Issues During Periods? These Tips Can Help,"Updated: Jul 10, 2025 11:51 IST","Bowel issues during periods are quite common due to hormonal changes, especially fluctuating levels of prostaglandins and progesterone. These hormones can affect digestion and bowel movement patterns, leading to symptoms like diarrhoea, constipation, bloating, or abdominal cramping. Prostaglandins can stimulate muscle contractions in the intestines, resulting in looser stools, while a drop in progesterone may slow digestion, causing constipation. While these symptoms are usually harmless, they can be uncomfortable. Fortunately, some simple dietary and lifestyle tips can help ease bowel-related issues during menstruation. In this article, we outline a list of tips that can help minimise bowel issues one might experience during their periods.  Conditions like endometriosis, fibroids, or pelvic inflammatory disease may cause intense menstrual pain and require medical attention. Below we discuss common causes. Steering clear of certain foods, habits, or activities can help reduce these symptoms, stabilise energy levels, and support your bodys natural rhythm.  Drinking plenty of water helps prevent constipation and supports healthy digestion. It can also reduce bloating by flushing out excess sodium and aiding smooth bowel movement.  Fibre-rich foods like oats, whole grains, fruits, and vegetables can help regulate your bowel movements. Soluble fibre eases diarrhoea by absorbing excess water, while insoluble fibre combats constipation.  Caffeine can stimulate the bowels too much, worsening diarrhoea, while sugary drinks can cause bloating and gas. Reducing these during your period can help stabilise your digestion.  Some people become temporarily more lactose intolerant during their period. If dairy makes you gassy or bloated, consider skipping it to ease bowel discomfort.  Foods like yogurt, kefir, or fermented vegetables support healthy gut bacteria, which can help balance digestion and reduce cramping or irregular bowel habits.  Gentle exercise, like walking or yoga, stimulates digestion and reduces bloating and constipation. It also helps with overall period pain and mood regulation.  Instead of heavy meals, try eating lighter meals more often. This helps your digestive system cope better and can prevent bloating or sudden bowel urgency.  These can irritate the stomach and speed up digestion, increasing the chances of diarrhoea or stomach cramps. Stick to easily digestible meals during your period.  A warm compress or heating pad not only relieves cramps but can also relax your intestinal muscles, easing bowel movements and abdominal discomfort.  Keep a journal of your bowel habits and diet during your cycle. This can help you identify patterns or food triggers and make it easier to adjust your routine accordingly.  Follow these tips today to overcome bowel issues during periods.  Disclaimer: This content including advice provides generic information only. It is in no way a substitute for a qualified medical opinion. Always consult a specialist or your own doctor for more information. NDTV does not claim responsibility for this information.",2025-11-28 20:32:24,Positive
https://doctor.ndtv.com/living-healthy/kidney-stones-these-foods-might-be-an-enemy-8849753,Kidney Stones? These Foods Might Be An Enemy,"Updated: Jul 9, 2025 06:33 IST","Kidney stones are hard mineral and salt deposits that form in the kidneys when urine becomes too concentrated, allowing these substances to crystallise and stick together. They can vary in size and cause severe pain, especially when passing through the urinary tract. While genetics, dehydration, and certain health conditions contribute to their formation, diet plays a major role too. Some foods can increase levels of oxalate, calcium, uric acid, or sodium in the urine, compounds that can contribute to kidney stone formation. Being aware of these ""enemy"" foods can help those prone to stones prevent recurrence and protect their kidney health. In this article, we share foods to avoid if you have kidney stones.  Kidney stones can cause severe pain and discomfort. Several diet modifications can help in controlling the risk of kidney stones. Here are some foods you must avoid. Kidney stones: A diet high in protein and salt can lead to formation of kidney stones. Read here to know foods to eat and avoid for preventing kidney stones.  Spinach is high in oxalates, which bind with calcium in the kidneys to form calcium oxalate stones, the most common type. While it's nutritious, consuming large amounts can raise the risk, especially when not balanced with calcium-rich foods.  Like spinach, beets contain high oxalate levels. People who are prone to calcium oxalate stones should limit beetroot and beet juice, as regular consumption can significantly increase oxalate buildup in urine.  Although healthy in moderation, nuts like almonds, cashews, and peanuts are oxalate-rich. For those with a history of kidney stones, consuming these in excess may worsen the risk of recurrence.  Dark chocolate and cocoa are surprisingly high in oxalates. While small amounts occasionally may be fine, regular or excessive consumption can be problematic for people susceptible to kidney stones.  Black tea is another oxalate-heavy beverage. Drinking too much especially without enough water can raise oxalate levels and contribute to stone formation. Herbal teas with lower oxalate content can be better alternatives.  Red meat is high in purines, which can increase uric acid levels in the body. Excessive uric acid can lead to uric acid stones. Cutting back on animal protein can help prevent these types of stones from forming.  High-sodium diets cause calcium to be excreted more in the urine, promoting calcium stone formation. Canned soups, chips, fast food, and other salty snacks are best minimised for kidney health.  Cola contains phosphoric acid, which may contribute to stone formation. Sugary sodas and beverages can also increase uric acid and reduce urine volume, both risk factors for kidney stones.  This vegetable is another oxalate-rich food that can spike levels in the urine. Its sharp sourness is matched by its strong effect on kidney stone formation in sensitive individuals.  High doses of vitamin C can be metabolised into oxalate in the body. Regular intake of large amounts may raise the risk of oxalate stones and should be avoided without medical guidance.  For individuals prone to kidney stones, understanding these dietary triggers is crucial. Staying hydrated, balancing intake of calcium and oxalates, and reducing salt and animal protein can go a long way in preventing painful stone episodes.  Disclaimer: This content including advice provides generic information only. It is in no way a substitute for a qualified medical opinion. Always consult a specialist or your own doctor for more information. NDTV does not claim responsibility for this information.",2025-11-28 20:32:27,Positive
https://doctor.ndtv.com/living-healthy/importance-of-proper-sleep-routine-in-teens-8848018,Importance Of Proper Sleep Routine In Teens,"Updated: Jul 9, 2025 02:27 IST","A consistent sleep routine is essential for good health, particularly for teenagers. During adolescence, the body undergoes significant physical, emotional, and mental changes, all of which are supported by adequate rest. However, due to academic pressures, screen time, and hormonal shifts, teens often experience irregular sleep patterns or sleep deprivation. A proper sleep routine helps regulate the body's internal clock, improves mood, supports brain development, and boosts overall well-being. For teens, maintaining a consistent sleep-wake cycle can enhance focus, emotional regulation, and even physical growth. Keep reading as we discuss why a proper sleep routine is important in teens.   Teenagers experience rapid physical growth, and most of this growth happens during deep sleep when growth hormone is released. A consistent sleep routine ensures that teens get enough of this deep sleep, supporting healthy development of bones, muscles, and tissues.  Sleep directly impacts cognitive functions like memory, focus, and problem-solving. Teens with a consistent sleep schedule tend to perform better academically because their brain gets the rest it needs to process and retain information effectively.  Lack of sleep is linked to mood swings, irritability, and even anxiety and depression. A proper sleep routine helps stabilise emotions and boosts mental resilience, which is especially important for teens navigating social and emotional changes.  Sleep strengthens the immune system by allowing the body to repair and fight off infections. During monsoon and seasonal shifts, when teens are more prone to getting sick, a consistent sleep routine helps in keeping their immunity strong.  Irregular sleep patterns can disrupt the balance of hunger hormones, leading to poor food choices and overeating. Teens who sleep well are more likely to maintain a healthy weight and have better control over their appetite.  Teenagers are often affected by acne and other skin issues. Quality sleep allows for skin regeneration and reduces inflammation, making a consistent sleep routine a natural skincare aid.  Sleep recharges the body. Teens involved in sports or physical activities need regular, quality sleep for muscle recovery, endurance, and energy. It directly affects their athletic and daily performance.  Sleep is crucial for maintaining hormonal balance, especially during puberty. Disrupted sleep can affect hormones like melatonin, cortisol, and insulin, potentially impacting mood, growth, and even metabolism.  Teens are known for impulsive behaviour, and sleep deprivation worsens this by impairing judgment and risk assessment. A regular sleep pattern promotes clearer thinking and better decision-making.  Developing a sleep routine during the teenage years creates a strong foundation for long-term health. It instills discipline, improves time management, and sets the tone for a healthier adult lifestyle.  Adopt a healthy sleep routine to boost your health today.   Disclaimer: This content including advice provides generic information only. It is in no way a substitute for a qualified medical opinion. Always consult a specialist or your own doctor for more information. NDTV does not claim responsibility for this information.",2025-11-28 20:32:28,Positive
https://doctor.ndtv.com/living-healthy/best-immunity-boosting-foods-to-prevent-viral-illness-this-monsoon-8844373,Best Immunity-Boosting Foods To Prevent Viral Illness This Monsoon,"Updated: Jul 8, 2025 08:04 IST","The monsoon season brings much-needed relief from the heat, but it also increases the risk of infections and illnesses. Increased humidity and dampness provide a favourable environment for infection-causing organisms to thrive. Therefore, it is of utmost importance to maintain a strong immune system. Boosting immunity during this time helps the body fend off common ailments like colds, flu, and other infections. Here, we have a list of immunity-boosting foods you must add to your monsoon diet. During the rainy season, you must make a few changes to your diet. Adding a few superfoods to your diet can help you stay healthy and disease-free. Continue reading as we share a list of superfoods that can strengthen your immune system. Haldi or turmeric is well-known for its anti-inflammatory and antioxidant properties. Turmeric can strengthen the immune system and fight off infections. It can be added to various dishes or consumed as a golden milk. Fruits like oranges, lemons, and guavas are rich in vitamin C, which is essential for a healthy immune system. The Indian Gooseberry is rich in vitamin C and antioxidants. It can help boost immunity and aid in digestion. Amla can be consumed raw, as juice, or in powdered form. Studies suggest that moringa can help fight against foodborne bacterial infections. Additionally, moringa leaves can help boost liver health, treat upset stomach, improve cardiovascular health and reduce blood pressure. Fermented foods like yogurt and buttermilk can promote gut health, which is closely linked to a strong immune system. Tulsi or holy basil is a powerful Ayurvedic herb that can help boost immunity. You can brew tusli leaves or consume them raw. Renowned for its immune-boosting qualities, garlic can be added to a variety of dishes and is particularly beneficial when consumed raw. Including these foods in your diet can help strengthen your immunity during the monsoon and keep infections at bay. Remember to also stay hydrated and maintain proper hygiene to combat the challenges of the rainy season! Disclaimer: This content including advice provides generic information only. It is in no way a substitute for a qualified medical opinion. Always consult a specialist or your own doctor for more information. NDTV does not claim responsibility for this information.",2025-11-28 20:32:31,Positive
https://doctor.ndtv.com/cancer/10-foods-to-reduce-risk-of-colon-cancer-8843949,10 Foods To Reduce Risk Of Colon Cancer,"Updated: Jul 8, 2025 06:55 IST","Colon cancer, also known as colorectal cancer, is a type of cancer that starts in the large intestine (colon) or rectum. It often begins as small, noncancerous clumps of cells called polyps that can develop into cancer over time. Common risk factors include age, family history, sedentary lifestyle, obesity, smoking, alcohol consumption, and a diet low in fibre and high in red or processed meats. Fortunately, certain dietary choices can play a key role in reducing the risk of colon cancer. Keep reading as we share a list of foods you can have to reduce risk of colon cancer.  Below we share a list of fibre-rich foods you can add to your diet to reduce the risk of colon cancer. Nutritionist Lovneet Batra throws light on certain health benefits of whole grains.  These are rich in fibre, folate, and antioxidants like lutein and carotenoids. They help flush out toxins, reduce inflammation in the colon, and support regular bowel movements, which lower the chances of polyps and cancer formation.  These vegetables contain sulforaphane, a plant compound known for its cancer-fighting properties. Studies show that these veggies can inhibit the growth of cancer cells and detoxify the body of harmful carcinogens.  Whole grains are packed with dietary fibre, which adds bulk to stool and promotes faster elimination of waste, reducing the contact time of potential carcinogens with the colon lining. They also improve gut health and reduce inflammation.  Rich in resistant starch and soluble fibre, legumes help nourish beneficial gut bacteria. This process produces short-chain fatty acids that have anti-cancer properties and reduce inflammation in the colon.  Berries are loaded with powerful antioxidants such as anthocyanins, ellagic acid, and vitamin C. These compounds help protect colon cells from oxidative stress and DNA damage that could lead to cancer.  Omega-3 fatty acids in fatty fish have been linked to lower levels of inflammation in the body. Regular consumption of omega-3-rich fish may help reduce the risk of colon cancer by decreasing the inflammatory response in the digestive tract.  Garlic contains sulphur compounds that activate liver enzymes to destroy carcinogens. Its antibacterial properties also support gut health and may reduce the formation of cancer-causing substances in the colon.  Curcumin, the active compound in turmeric, has strong anti-inflammatory and antioxidant effects. It may slow the growth of cancer cells and prevent the spread of tumours, making it a valuable addition to a colon-friendly diet.  Probiotics promote a healthy gut microbiome, which plays a major role in immune defence and inflammation control. Regular intake of yogurt with live cultures can help maintain digestive balance and lower the risk of colon issues.  Nuts provide fibre, healthy fats, and antioxidants like selenium and vitamin E. These nutrients combat oxidative stress and support colon health. Moderate consumption of nuts has been linked to a reduced risk of colorectal cancer.  Foods rich in fibre, antioxidants, and anti-inflammatory properties help maintain digestive health, support the gut microbiome, and may prevent the development of cancerous cells in the colon.  Disclaimer: This content including advice provides generic information only. It is in no way a substitute for a qualified medical opinion. Always consult a specialist or your own doctor for more information. NDTV does not claim responsibility for this information.",2025-11-28 20:32:32,Positive
https://doctor.ndtv.com/living-healthy/you-can-catch-these-diseases-from-your-pets-8841745,You Can Catch These Diseases From Your Pets,"Updated: Jul 8, 2025 01:50 IST","Humans can catch certain diseases from their pets and these are called zoonotic diseases. While pets offer companionship and health benefits, they can also carry bacteria, viruses, parasites, or fungi that may spread to people. The risk increases with poor hygiene, weakened immune systems, or lack of preventive pet care. However, most pet-related infections are preventable with proper pet handling, regular vet visits, cleanliness, and good personal hygiene. Keep reading as we discuss some diseases you can catch from your pets and how to avoid them.   A fungal infection that affects the skin, scalp, or nails. Pets like cats and dogs can carry it and transmit it through direct contact. Regularly bathe and groom pets. Disinfect areas your pet frequently visits. Avoid touching animals with bald patches or lesions. Always wash your hands after petting or handling pets.  Toxoplasmosis is caused by a parasite found in cat faeces. It's especially risky for pregnant women and those with weak immune systems. Clean the litter box daily while wearing gloves (preferably someone else should do it during pregnancy), and wash hands thoroughly afterward. Avoid undercooked meat, another source of the parasite.  A bacterial infection caused by Bartonella henselae, usually spread through scratches or bites from infected cats. Avoid rough play with cats, especially kittens. Clean scratches or bites immediately with soap and water. Keep cats indoors and flea-free.  Caused by Salmonella bacteria, which can be transmitted through handling reptiles, birds, or contaminated pet food (especially raw diets). Always wash your hands after touching pets or their food. Keep reptiles away from kitchens and children under 5. Avoid feeding pets raw meat without veterinary advice.  A bacterial infection often spread through the urine of infected dogs or wild animals. Humans can contract it through contaminated water or soil. Vaccinate your dog, avoid walking them in floodwaters or muddy areas, and wear gloves when cleaning up pet urine or waste.  A bacterial infection that causes diarrhoea in humans, often transmitted by handling puppies or kittens with diarrhoea. Practice good hygiene when cleaning up after pets. Wash hands after pet contact, especially before eating or cooking.  A deadly virus transmitted through bites from infected animals. It affects the nervous system and is almost always fatal once symptoms appear. Ensure pets are vaccinated against rabies. Avoid contact with stray or wild animals. Seek immediate medical care if bitten or scratched.  These parasites live in the intestines of pets and can be passed to humans through faeces-contaminated soil or pet fur. They can cause skin infections or more serious internal issues. Deworm pets regularly. Promptly clean up pet faeces. Teach children not to play in areas where pets relieve themselves, and ensure they wash their hands afterward.  Regular veterinary checkups, proper pet hygiene, clean surroundings, and awareness are your best tools to enjoy a safe, healthy bond with your furry (or feathery or scaly) friend.  Disclaimer: This content including advice provides generic information only. It is in no way a substitute for a qualified medical opinion. Always consult a specialist or your own doctor for more information. NDTV does not claim responsibility for this information.",2025-11-28 20:32:33,Positive
https://doctor.ndtv.com/living-healthy/incorporate-these-ayurvedic-hacks-this-monsoon-to-avoid-seasonal-ailments-8837345,Incorporate These Ayurvedic Hacks This Monsoon To Avoid Seasonal Ailments,"Updated: Jul 7, 2025 04:51 IST","Ayurvedic hacks can be highly effective in preventing seasonal ailments during the monsoon. According to Ayurveda, the rainy season aggravates the Vata and Kapha doshas while weakening Agni (digestive fire), making the body more prone to infections, indigestion, respiratory issues, and joint pain. Ayurveda recommends natural, holistic practices using herbs, spices, diet, and daily routines to balance these doshas, boost immunity, and protect against common monsoon ailments like colds, coughs, fevers, skin infections, and digestive problems. Read on as we share Ayurvedic hacks to help avoid ailments this monsoon.   Drinking warm water infused with ginger or tulsi leaves first thing in the morning helps kindle digestive fire (Agni), flush out toxins, and prevent throat infections. It strengthens the respiratory system and prepares your gut for the day ahead.  Triphala, a mix of amla, haritaki, and bibhitaki helps cleanse the digestive system, prevent constipation, and boost immunity. Consuming it at night with warm water keeps your gut clean and strengthens your overall resistance to infections.  Performing a warm oil massage using sesame oil (or medicated oils like Narayana Tailam) helps calm aggravated Vata, nourishes the skin, lubricates the joints, and improves blood circulation. It also acts as a barrier against skin infections caused by dampness.  Ayurveda advises adding spices like cumin, black pepper, turmeric, ajwain, and asafoetida (hing) to your monsoon meals. These enhance digestion, reduce bloating, and prevent foodborne infections, common during the humid season.  Raw greens can harbour bacteria and worsen digestion during monsoon. Instead, opt for warm, cooked, easy-to-digest foods like khichdi, soups, and steamed vegetables. This helps maintain a balanced Agni and prevents gastrointestinal issues.  Sipping herbal teas made with ingredients like tulsi, cinnamon, cardamom, or mulethi (licorice) helps fight off colds, maintain respiratory health, and keeps the body warm and light. These teas are also calming and support immunity.  Day sleeping during monsoon can increase Kapha accumulation, slowing down metabolism and inviting lethargy, cold, and cough. Ayurveda suggests staying active during the day and resting well at night to maintain natural body rhythms.  Burning camphor or Ayurvedic herbs like sambrani in the home helps purify the air, kill germs, and uplift the mood. It also prevents mould and damp-related respiratory discomfort that are common in monsoon months.  Mixing a pinch of turmeric in a spoon of honey and consuming it in the morning can strengthen your immune response. Both ingredients are natural antibiotics and help fight inflammation, throat irritation, and viral infections.  Cold, oily, or deep-fried foods aggravate Kapha and dampen digestive fire, leading to sluggish digestion, colds, and sore throats. Stick to freshly cooked, warm meals with minimal oil to stay light and energised.  Incorporating simple, time-tested Ayurvedic hacks can help keep the body strong, the mind calm, and the immune system resilient throughout the damp season.   Disclaimer: This content including advice provides generic information only. It is in no way a substitute for a qualified medical opinion. Always consult a specialist or your own doctor for more information. NDTV does not claim responsibility for this information.",2025-11-28 20:32:34,Positive
