link,headline,datetime_posted,content,scraped_at,analysis_result
https://doctor.ndtv.com/pregnancy/stress-during-pregnancy-affects-babys-brain-before-birth-follow-these-tips-to-manage-stress-8298088,"Stress During Pregnancy Affects Baby's Brain Before Birth, Says Study; Follow These Tips To Manage Stress","Updated: Apr 30, 2025 09:54 IST"," Pregnancy can be a stressful period for the mother. Most of the time, mothers are worried about the well-being of their unborn child. However, too much stress can be harmful to both the mother and the baby. Pregnancy is a delicate phase that involves several physical, hormonal and psychological changes. A new study has revealed that stress during pregnancy can affect babies even before birth. The research has revealed that paternal stress can change small RNA molecules in the blood of newborns, especially in girls. Here's a guide to seven easily available biotin-rich foods that are beneficial and safe during pregnancy. Here we outline in detail the many benefits of exercising for seniors. Feeling stressed is common during pregnancy. High stress levels in pregnancy may contribute to several issues such as high blood pressure, which may increase the chance of preterm labor or low birth weight. Stress can also contribute to issues like preeclampsia, eclampsia, and fetal growth restriction. Studies also suggest that increased cortisol levels during pregnancy may increase cortisol levels in a fetus, increasing the risk of developmental issues. Emotional stress during pregnancy may also affect cognitive development and may lead to attention difficulties and behavioural problems in a child. 1. Practice relaxation techniques: Try deep breathing exercises, meditation, or yoga tailored for pregnancy. 2. Stay active: Gentle exercises are safe during pregnancy like walking. Staying physically active can help boost mood, reduce stress and also keep you fit during pregnancy. Always consult with your doctor to determine safe activities. 3. Prioritise self-care: Take time for yourself daily. Engage in activities like reading a book, taking a warm bath or any activity that you find enjoyable and relaxing. 4. Eat right: Proper nutrition helps promote healthy development of the baby and also supports mental well-being. Focus on consuming a well-balanced diet. 5. Limit caffeine and sugar: Excessive caffeine and sugar consumption can contribute to anxiety and may impact your sleep. 6. Seek professional help: If stress becomes overwhelming, consider consulting with a therapist or counsellor who specialises in pregnancy. Try these strategies and manage stress effectively during pregnancy. Disclaimer: This content including advice provides generic information only. It is in no way a substitute for a qualified medical opinion. Always consult a specialist or your own doctor for more information. NDTV does not claim responsibility for this information.",2025-05-03 05:10:30,Positive
https://doctor.ndtv.com/health-supplements/these-supplements-can-help-reduce-brain-fog-8296229,These Supplements Can Help Reduce Brain Fog,"Updated: Apr 30, 2025 06:16 IST","Brain fog is a non-medical term used to describe a state of mental fatigue or clouded thinking, where a person may struggle with concentration, memory, mental clarity, and alertness. It can feel like mental sluggishness or being “spaced out.” Causes of brain fog range from stress, poor diet, lack of sleep, hormonal imbalances, and sedentary lifestyle, to underlying conditions like hypothyroidism, inflammation, or nutrient deficiencies. Supplements can help reduce brain fog when it's linked to nutritional gaps, chronic inflammation, oxidative stress, or neurotransmitter imbalances. Keep reading as we list supplements you can add to your diet to reduce brain fog.   Omega-3s are essential fats found in fish oil that support brain structure and function. DHA, in particular, makes up a large portion of the brain's grey matter. These fats reduce inflammation, improve communication between brain cells, and are known to enhance memory and mood. People deficient in omega-3s often report mental fatigue, so supplementation can help restore clarity and focus.  Vitamin B12 is vital for energy production and nerve health. A deficiency can lead to fatigue, memory issues, and confusion, all classic symptoms of brain fog. Supplementing with B12 supports the production of neurotransmitters like serotonin and dopamine and helps maintain the protective sheath around nerves (myelin), which is essential for fast and clear communication between brain cells.  Found naturally in green tea, L-theanine promotes relaxation without sedation. It helps calm the mind, improve focus, and reduce mental clutter. When combined with caffeine, L-theanine can enhance attention and working memory while minimising the jitteriness caffeine sometimes causes. This makes it especially useful for managing stress-induced brain fog.  Ginkgo biloba enhances blood circulation to the brain, which helps deliver more oxygen and nutrients to brain tissues. This improved flow supports better concentration, mental sharpness, and memory retention. Ginkgo also has antioxidant properties that protect brain cells from oxidative stress, which is a key contributor to cognitive decline and fogginess.  Magnesium plays a role in over 300 enzymatic processes, including those related to brain and nervous system function. Low levels of magnesium can lead to irritability, anxiety, and poor concentration. Magnesium supplements, particularly magnesium threonate, have been shown to support synaptic plasticity and memory, helping clear brain fog caused by stress and sleep issues.  Acetyl-L-Carnitine also known as ALCAR supports energy production in brain cells by transporting fatty acids into mitochondria. It also helps produce acetylcholine, a key neurotransmitter involved in learning and memory. ALCAR has been shown to improve mental energy, clarity, and alertness, particularly in people experiencing fatigue or age-related cognitive decline.  Vitamin D plays a role in regulating mood, reducing inflammation, and supporting immune and brain health. Deficiency is often linked to depression, fatigue, and cognitive issues. Supplementing with vitamin D, especially in those who get little sunlight, can help lift brain fog by enhancing mood-regulating chemicals and reducing inflammatory responses in the brain.  Supplements work by supporting brain function, improving blood flow, reducing inflammation, and enhancing the production of essential brain chemicals. Add them to your routine today to boost health.   Disclaimer: This content including advice provides generic information only. It is in no way a substitute for a qualified medical opinion. Always consult a specialist or your own doctor for more information. NDTV does not claim responsibility for this information.",2025-05-03 05:10:31,Positive
https://doctor.ndtv.com/pregnancy/7-biotin-rich-foods-for-a-healthy-pregnancy-8295970,7 Biotin-Rich Foods For A Healthy Pregnancy,"Updated: Apr 30, 2025 08:17 IST","Biotin, also known as vitamin B7, is a water-soluble B-complex vitamin that plays a crucial role during pregnancy. It supports foetal development, enhances energy production, aids in metabolism, and helps maintain healthy skin, hair, and nails. According to the National Institutes of Health (NIH) and World Health Organisation (WHO) guidelines, biotin deficiency during pregnancy can be more common than expected due to increased demand and changes in metabolism. Including biotin-rich foods in a prenatal diet can promote maternal and foetal health. Here's a guide to seven easily available biotin-rich foods that are beneficial and safe during pregnancy. Pregnancy increases the body's demand for essential nutrients, and biotin is no exception. It supports embryo development, helps convert food into energy, and plays a key role in forming enzymes necessary for cellular growth. Low biotin levels have been linked to birth defects in some studies. Hence, including biotin-rich foods is a natural way to support a healthy pregnancy. Try these 7 biotin-rich foods to include during pregnancy. Let's explore the science behind this fermented favourite. With packed itineraries and limited access to clean facilities, hygiene can often take a back seat. Here are 7 essential hygiene tips to help you stay healthy and safe while travelling. Egg yolks are one of the richest sources of biotin. Just one cooked egg yolk provides a good amount of this nutrient. Ensure eggs are fully cooked to avoid any risk of salmonella during pregnancy. Almonds, walnuts, sunflower seeds, and peanuts are not only rich in biotin but also contain healthy fats and protein. A small handful as a snack or sprinkled over salads can boost your biotin intake. Loaded with vitamins, fibre, and antioxidants, sweet potatoes also offer biotin. Their high vitamin A content also supports foetal eye and skin development, making them a pregnancy-friendly food. Bananas are rich in potassium and moderate in biotin, making them a great option for energy and nutrition. They're also easy on the stomach, helping with morning sickness or nausea during the first trimester. This leafy green is packed with iron, folate, and biotin, nutrients essential for pregnancy. Consuming lightly cooked spinach helps absorb the nutrients more effectively while reducing oxalate content. Whole wheat bread, oats, and brown rice contain moderate levels of biotin along with fibre, iron, and B-complex vitamins. Opting for whole grains ensures long-lasting energy and digestive health during pregnancy. Milk, yoghurt, and cheese offer not just calcium and protein but also a decent dose of biotin. These are great options for women who tolerate dairy well and are looking to diversify their sources. From supporting foetal development to maintaining maternal energy levels, it's vital to include biotin-rich foods in your daily diet. 1. Opt for fresh, whole foods over processed supplements when possible 2. Combine biotin-rich foods with other B vitamins for better absorption 3. Maintain a balanced, varied diet to meet all micronutrient needs 4. Always consult your doctor before starting any supplements Biotin is a key player in ensuring a smooth and healthy pregnancy journey. The best part? These foods are easily accessible and versatile. Before making any major dietary changes, always check with your healthcare provider to personalise your nutritional needs.   Disclaimer: This content including advice provides generic information only. It is in no way a substitute for a qualified medical opinion. Always consult a specialist or your own doctor for more information. NDTV does not claim responsibility for this information.",2025-05-03 05:10:32,Positive
https://doctor.ndtv.com/children/what-is-parasomnia-in-children-8295944,What Is Parasomnia In Children?,"Updated: Apr 30, 2025 06:09 IST","Sleep plays a vital role in a child's physical and mental development. However, certain sleep disorders like parasomnia can interrupt this essential rest. Parasomnia refers to unusual behaviours or experiences during sleep, including sleepwalking, night terrors, talking during sleep, or waking up confused. These disturbances, though often harmless, can be alarming for parents and caregivers. According to the American Academy of Sleep Medicine (AASM), parasomnias are more prevalent in children than adults and usually occur during transitions between sleep stages. Early awareness and management can ensure better sleep hygiene and reduce risks associated with parasomnias in growing children. Parasomnias in children are typically classified into non-REM (NREM) and REM-related disorders. They can range from mild to severe, and while most children outgrow them, persistent symptoms may need medical attention. Here are the common types of parasomnias in children. Let's explore the science behind this fermented favourite. With packed itineraries and limited access to clean facilities, hygiene can often take a back seat. Here are 7 essential hygiene tips to help you stay healthy and safe while travelling. One of the most well-known parasomnias, sleepwalking involves a child moving around while still asleep. It usually occurs in deep NREM sleep and may involve aimless walking or attempts to leave the house. Safety precautions are essential. Unlike nightmares, night terrors cause a child to scream, sweat, and appear terrified, often with open eyes, but they won't be awake or responsive. These episodes typically occur early in the night and the child has no memory of them. Children experiencing this may wake up confused, disoriented, or upset. They might mumble or thrash around, but not be fully awake. These episodes usually happen during deep sleep and subside on their own. Common and usually harmless, sleep talking involves mumbling or even complete sentences during sleep. It's often triggered by stress, fever, or lack of sleep. Unlike night terrors, nightmares occur during REM sleep and are vividly remembered. If frequent, they may indicate emotional stress or trauma and can disrupt sleep quality. Although rare in children, sleep paralysis involves temporary inability to move or speak upon waking. It can be frightening but is usually harmless and linked to poor sleep cycles. Though often not classified strictly as parasomnia, persistent bedwetting in older children may coincide with other sleep disturbances and needs evaluation if it continues beyond the typical age. According to the National Sleep Foundation, common parasomnias include sleepwalking, night terrors, confusional arousals, and nightmares, often influenced by stress, fever, or irregular sleep schedules. A family history of parasomnias increases the likelihood in children. Irregular sleep routines and insufficient rest can trigger episodes. Emotional disturbances or trauma can contribute to nightmares and sleepwalking. High temperatures can increase the frequency of night terrors. Some drugs affecting the nervous system may induce parasomnias. Sudden noise or light changes during sleep can trigger abnormal sleep behaviours. Always consult a paediatrician if symptoms persist, worsen, or impact daytime functioning, early intervention can make all the difference in a child's wellbeing. Ensure regular bedtime and wake-up times. Avoid screens, loud noises, and caffeine before bed. These can reduce fear associated with night terrors or nightmares. Help children express emotions and reduce anxiety through play or therapy. Lock doors and windows, remove obstacles, and avoid bunk beds for sleepwalkers. If parasomnias are frequent or disruptive, a medical evaluation is advised. Parasomnia in children, while concerning for parents, is often a temporary phase that resolves with time and proper sleep hygiene. Understanding the types, triggers, and management strategies can provide reassurance and improve a child's sleep quality.   Disclaimer: This content including advice provides generic information only. It is in no way a substitute for a qualified medical opinion. Always consult a specialist or your own doctor for more information. NDTV does not claim responsibility for this information.",2025-05-03 05:10:33,Positive
https://doctor.ndtv.com/living-healthy/7-common-triggers-of-migraine-in-summers-8295916,7 Common Triggers Of Migraine In Summers,"Updated: Apr 30, 2025 06:32 IST","For migraine sufferers, summer isn't always sunshine and happiness. Rising temperatures, intense humidity, and shifting routines can all become silent triggers. According to the World Health Organisation (WHO) and studies published by the American Migraine Foundation, environmental factors such as heat, dehydration, and bright light can exacerbate migraine episodes, particularly in warmer months. Understanding these seasonal triggers is essential for individuals who experience recurrent migraine attacks. By identifying and avoiding specific summer-related stimuli, people can reduce both the frequency and severity of migraines, leading to better control and an improved quality of life during the hottest months of the year. Summer heat can influence neurological and vascular systems, increasing the risk of migraines. Sudden weather changes, sun exposure, and poor hydration may lead to dilated blood vessels, a known contributor to migraines. According to the National Headache Foundation, these environmental factors often intensify the condition. Recognising these patterns is the first step toward prevention and effective migraine management. These are the most common triggers of migraine in summers. Let's explore the science behind this fermented favourite. With packed itineraries and limited access to clean facilities, hygiene can often take a back seat. Here are 7 essential hygiene tips to help you stay healthy and safe while travelling. Sweating more in the heat without replenishing fluids can lead to dehydration, a top migraine trigger. Even mild dehydration can cause headaches. Always carry water, and increase intake of fluids, especially when outdoors. Bright sunlight and high UV rays can overstimulate the brain's visual cortex. Prolonged exposure can lead to photophobia (light sensitivity) and trigger migraines. Sunglasses, wide-brimmed hats, and limiting time outdoors during peak hours are essential. High temperatures combined with humidity can cause your body to overheat, disturbing internal temperature regulation and increasing the risk of migraine. Stay in cool environments and use fans or air-conditioning to reduce impact. Summer routines often lead to irregular eating. Skipping meals causes blood sugar levels to drop, a common migraine trigger. Eat light but balanced meals every 3-4 hours to maintain energy and avoid crashes. Longer days can disrupt the body's sleep-wake cycle, especially if you're staying up late or waking earlier. Poor or irregular sleep is directly linked to migraine episodes. Aim for 7-9 hours of quality sleep daily. Cold coffees, sodas, and energy drinks may seem refreshing but often contain caffeine and sugar, both of which can aggravate migraines. Sudden intake or withdrawal from caffeine can also contribute to headaches. Summer often brings stronger odours, perfumes, sweat, pesticides, or chlorinated pool water, all of which can trigger migraines in sensitive individuals. Also, increased pollen and pollution can worsen sinus inflammation, another migraine pathway. Simple changes like staying hydrated, regulating sleep, and protecting yourself from extreme heat and sunlight go a long way. With vigilance and preventive care, those prone to migraines can enjoy a more comfortable and pain-free summer season. 1. Maintain a migraine diary to track specific seasonal triggers 2. Use cooling face towels and stay indoors during high-heat hours (12-4 pm) 3. Eat hydrating foods like cucumbers, watermelon, and yoghurt 4. Avoid sudden exposure to air conditioning after extreme heat 5. Keep sunglasses and an umbrella handy when outdoors 6. Limit screen time to avoid light-triggered headaches 7. Try relaxation techniques like meditation or breathing exercises to reduce stress While migraines can feel unpredictable, recognising and managing summer-specific triggers can make a substantial difference. When in doubt, always consult a healthcare provider for personalised guidance.   Disclaimer: This content including advice provides generic information only. It is in no way a substitute for a qualified medical opinion. Always consult a specialist or your own doctor for more information. NDTV does not claim responsibility for this information.",2025-05-03 05:10:34,Positive
https://doctor.ndtv.com/diabetes/7-high-glycemic-foods-diabetics-should-avoid-8295895,7 High Glycemic Foods Diabetics Should Avoid,"Updated: Apr 30, 2025 06:22 IST","Managing diabetes effectively requires more than just medication, it hinges heavily on dietary choices. One of the most important factors in diabetic nutrition is the glycemic index (GI) of foods. The World Health Organisation (WHO) and the American Diabetes Association (ADA) both highlight the importance of avoiding high-GI foods, as they can cause rapid spikes in blood glucose levels. These foods are quickly broken down into sugar, which makes them risky for people with type 2 or type 1 diabetes. Being aware of high-GI foods and replacing them with healthier alternatives is key to keeping blood sugar levels stable and avoiding complications. The glycemic index ranks carbohydrates from 0 to 100 based on how fast they raise blood sugar. High-GI foods (above 70) cause sharp increases in glucose, leading to insulin spikes. Over time, this can worsen insulin resistance and increase the risk of complications. Monitoring GI can help diabetics maintain stable sugar levels and support long-term metabolic health. Here are mentioned 7 high glycemic foods diabetics should avoid. Let's explore the science behind this fermented favourite. With packed itineraries and limited access to clean facilities, hygiene can often take a back seat. Here are 7 essential hygiene tips to help you stay healthy and safe while travelling. Made from refined flour, white bread has a GI of around 75. It lacks fibre and nutrients, leading to a fast release of sugar into the bloodstream. Opt for wholegrain or multigrain bread instead. Cornflakes and puffed rice cereals may seem convenient, but they are among the highest GI foods (GI 80+). Choose high-fibre oats or unsweetened muesli to prevent sugar spikes after breakfast. Polished white rice, especially when overcooked, has a GI above 70. It can significantly raise post-meal glucose levels. Brown rice, quinoa, or millets like bajra or jowar are much healthier alternatives for Indian diets. Potatoes have a naturally high starch content. Mashed potatoes, with a GI of 85 or more, are especially problematic. Sweet potatoes or boiled potatoes in moderation with fibre-rich meals may be safer. These are loaded with added sugars and lack fibre, causing an immediate sugar surge. Their GI is often above 75. Diabetics should stick to water, unsweetened herbal teas, or diluted fresh lemon water. Refined pasta is quickly digested and converted into glucose. It ranks high on the GI scale unless paired with fibre and protein. Whole wheat pasta or zucchini noodles offer better glycemic control. While nutritious, watermelon has a GI of 76. Though its glycemic load is moderate due to high water content, large servings can still cause a sugar spike. Limit portion size and balance with protein. Replacing these items with low-GI, nutrient-rich alternatives is a simple yet powerful step toward better health and a more balanced lifestyle. 1. Combine high GI items with protein or fibre to slow glucose absorption. 2. Avoid cooking starchy foods for too long, as this increases their GI. 3. Use the “plate method”: half veggies, one-quarter protein, and one-quarter whole grain. 4. Keep a food diary to track reactions to specific foods. Understanding and managing the glycemic index of your diet is crucial for diabetes care. By avoiding or limiting these high-GI foods, diabetics can maintain more consistent blood sugar levels and reduce the risk of long-term complications.   Disclaimer: This content including advice provides generic information only. It is in no way a substitute for a qualified medical opinion. Always consult a specialist or your own doctor for more information. NDTV does not claim responsibility for this information.",2025-05-03 05:10:35,Positive
