link,headline,datetime_posted,content,scraped_at,analysis_result
https://doctor.ndtv.com/living-healthy/is-kombucha-beneficial-for-your-gut-health-8313711,Is Kombucha Beneficial For Your Gut Health?,"Updated: May 2, 2025 07:13 IST","Kombucha, a fizzy fermented tea, has emerged as a popular health beverage across the globe. Touted as a natural probiotic, kombucha is often linked to improved digestion, better gut health, and even immune support. Made by fermenting sweetened tea with a symbiotic culture of bacteria and yeast (SCOBY), this ancient drink has been consumed for centuries. But does it really deliver on its health promises, especially for the gut? According to the National Institutes of Health (NIH) and other studies, kombucha may play a supportive role in gut microbiome diversity. Let's explore the science behind this fermented favourite. Kombucha contains natural probiotics and bioactive compounds that may help balance gut bacteria and enhance digestion. During fermentation, beneficial bacteria and organic acids are produced, which can aid the gut microbiome. According to a review published in Frontiers in Microbiology, fermented foods like kombucha can positively influence gut flora, which is essential for nutrient absorption, immune function, and overall digestive well-being. With packed itineraries and limited access to clean facilities, hygiene can often take a back seat. Here are 7 essential hygiene tips to help you stay healthy and safe while travelling. Let's explore why eating a few tulsi leaves every day could be a powerful step toward holistic well-being. The fermentation process produces several strains of live beneficial bacteria, such as Lactobacillus and Acetobacter. These probiotics may help restore the balance of gut flora, especially after antibiotic use or poor dietary habits. A healthy gut microbiome is linked to better digestion, reduced inflammation, and even mental well-being. However, the quantity and strains vary by brand and brew method. Kombucha contains enzymes and organic acids like acetic acid and gluconic acid, which may assist in breaking down food more efficiently. Anecdotal evidence and some early studies suggest that regular consumption of kombucha may alleviate bloating, gas, and indigestion by supporting the body's natural digestive processes. Green or black tea, the base for kombucha, is rich in polyphenols and antioxidants. These compounds can protect the gut lining from oxidative stress and inflammation. Damage to the gut lining is often associated with leaky gut syndrome, food sensitivities, and autoimmune responses, making antioxidant support beneficial for long-term gut health. About 70% of your immune system resides in your gut. A healthy gut microbiome can help modulate immune responses. The probiotics in kombucha may help maintain this balance, reducing your susceptibility to infections and inflammatory responses. While more human clinical trials are needed, the existing data is promising. Gut dysbiosis, or an imbalance in gut microbes, has been linked to several conditions like irritable bowel syndrome (IBS), obesity, and even depression. Regular intake of fermented foods, including kombucha, may help prevent or correct such imbalances. A study in Nutrients (2021) reported that probiotic-rich foods could improve symptoms in individuals with mild digestive disorders. While kombucha is primarily known for probiotics, it may also contain small amounts of prebiotics depending on its ingredients. Prebiotics are plant fibres that feed good bacteria. Ingredients like ginger or fruit add-ins in kombucha may enhance this effect, offering additional gut support. Despite its benefits, kombucha is not suitable for everyone. Unpasteurised kombucha can pose a risk for pregnant women, individuals with weakened immune systems, or those sensitive to caffeine or alcohol. Additionally, many commercial versions contain added sugars, which can negate its health benefits. Always read labels and consult a healthcare provider, especially if you have pre-existing conditions. Kombucha offers potential gut health benefits, largely due to its probiotic content and natural fermentation. While more large-scale human studies are needed, current evidence supports its role as a gut-friendly beverage when consumed in moderation. For optimal results, pair kombucha with a fibre-rich diet and other fermented foods. As always, individual needs vary, consult a doctor before making it a daily habit.   Disclaimer: This content including advice provides generic information only. It is in no way a substitute for a qualified medical opinion. Always consult a specialist or your own doctor for more information. NDTV does not claim responsibility for this information.",2025-05-03 05:10:19,Positive
https://doctor.ndtv.com/travel-and-health/7-hygiene-tips-to-keep-in-mind-while-travelling-8313687,7 Hygiene Tips To Keep In Mind While Travelling,"Updated: May 2, 2025 07:07 IST","Travelling opens up new experiences, but it can also expose you to unfamiliar germs and environments that may affect your health. Whether you're heading to a beach destination, trekking through the hills, or taking a business trip, maintaining personal hygiene is essential to prevent infections, digestive issues, and skin conditions. According to the World Health Organisation (WHO), proper hand hygiene and safe food practices are critical during travel to avoid communicable diseases. With packed itineraries and limited access to clean facilities, hygiene can often take a back seat. Here are 7 essential hygiene tips to help you stay healthy and safe while travelling. Travelling brings increased contact with public surfaces, shared restrooms, and changing food habits, all of which can heighten your risk of infections. From traveller's diarrhoea to respiratory illnesses, poor hygiene can quickly turn a vacation into a visit to the clinic. Being mindful of basic hygiene practices ensures you stay energetic, confident, and illness-free throughout your journey. Let's explore the science behind this fermented favourite. Let's explore why eating a few tulsi leaves every day could be a powerful step toward holistic well-being. Keeping your hands clean is your first line of defence. Always carry an alcohol-based hand sanitiser (at least 60% alcohol) and use it after touching public surfaces, handling money, or before eating. The WHO strongly recommends hand hygiene, especially when soap and water are not available, common while travelling. Trains, flights, and hotel rooms may not always be as clean as they appear. Use disinfectant wipes to clean surfaces such as tray tables, armrests, remote controls, toilet seats, and doorknobs. This reduces the chance of picking up germs left behind by previous users. Your hands touch dozens of surfaces every hour, escalator railings, cab doors, menus, and then may unknowingly transfer germs to your eyes, nose, or mouth. Avoid face-touching as much as possible to reduce the risk of respiratory and skin infections. Food-borne illnesses are common among travellers. Opt for freshly cooked meals and avoid raw, undercooked, or street food if unsure about cleanliness. Drink only bottled or filtered water and avoid ice cubes unless you're certain they're made with purified water. The Centres for Disease Control and Prevention (CDC) also recommends avoiding tap water in unfamiliar areas. Public toilets can be unhygienic, especially in remote or high-traffic areas. Carry toilet seat sanitisers, tissue rolls, disposable seat covers, and hand sanitiser. For longer trips, consider including intimate wipes and feminine hygiene products if needed. Maintaining toilet hygiene helps prevent urinary tract infections (UTIs) and skin issues. Sweat and grime accumulate more quickly during travel, especially in humid or hot destinations. Pack clothes made of breathable fabrics like cotton and change them daily. Avoid re-wearing socks or undergarments, as doing so may cause skin irritation or fungal infections. A small laundry bag or detergent sachets can help you keep your garments fresh. Skipping brushing during hectic travel days is common but harmful. Always carry a compact dental kit with a toothbrush, paste, floss, and mouthwash. Good oral hygiene not only prevents bad breath and cavities but also helps reduce the risk of infections that can spread through the bloodstream. Maintaining hygiene while travelling doesn't require complicated routines, it just needs awareness and a little preparation. By following simple yet effective practices, you can protect yourself from illnesses that might disrupt your journey. As travel resumes in full swing post-pandemic, personal hygiene is more crucial than ever. Stay cautious, stay clean, and enjoy a healthy, worry-free travel experience.   Disclaimer: This content including advice provides generic information only. It is in no way a substitute for a qualified medical opinion. Always consult a specialist or your own doctor for more information. NDTV does not claim responsibility for this information.",2025-05-03 05:10:20,Positive
https://doctor.ndtv.com/nutrition/health-benefits-of-consuming-raw-tulsi-leaves-8313644,Health Benefits Of Consuming Raw Tulsi Leaves,"Updated: May 2, 2025 07:11 IST","Tulsi, also known as Holy Basil, is more than just a sacred plant in Indian households, it is a treasure trove of health benefits. For centuries, Ayurvedic medicine has revered tulsi for its therapeutic properties, and modern science now validates many of these claims. Consuming raw tulsi leaves regularly is believed to boost immunity, support respiratory health, improve digestion, and manage stress levels. The Ministry of AYUSH and organisations like the World Health Organisation (WHO) recognise the role of traditional herbs like tulsi in preventive healthcare. Let's explore why eating a few tulsi leaves every day could be a powerful step toward holistic well-being. Tulsi leaves are packed with powerful antioxidants, essential oils, and bioactive compounds like eugenol, ursolic acid, and rosmarinic acid. These natural substances offer anti-inflammatory, antimicrobial, and adaptogenic effects that can protect your body from various ailments. Consuming the leaves raw ensures maximum potency, as heat or processing may diminish their active components. Let's explore the science behind this fermented favourite. With packed itineraries and limited access to clean facilities, hygiene can often take a back seat. Here are 7 essential hygiene tips to help you stay healthy and safe while travelling. Raw tulsi leaves strengthen the immune system by enhancing the body's ability to fight infections. They stimulate the production of antibodies and have natural antibacterial, antifungal, and antiviral properties. This makes them particularly helpful during seasonal changes or flu outbreaks. Regular consumption can reduce the frequency and severity of colds and fevers. Tulsi acts as a natural decongestant and expectorant, making it effective against respiratory ailments like asthma, bronchitis, and sinusitis. Chewing raw tulsi leaves can help clear phlegm, reduce cough, and ease breathing. Its antimicrobial nature also helps in managing bacterial infections of the respiratory tract. Tulsi is classified as an adaptogen, a natural substance that helps the body cope with physical and emotional stress. According to a study published in the Journal of Ayurveda and Integrative Medicine, tulsi significantly lowers cortisol (the stress hormone) levels and improves mood stability. Chewing raw leaves may help relieve anxiety and promote mental clarity. The compounds in tulsi help balance stomach acids, support healthy gut flora, and relieve digestive issues like bloating, gas, and indigestion. Chewing raw tulsi leaves before or after meals may stimulate digestive enzymes and promote smoother digestion. Tulsi's antibacterial properties make it excellent for oral hygiene. Chewing the leaves can help reduce bad breath, gum infections, and mouth ulcers. It also offers protection against oral pathogens that cause plaque formation and tooth decay. Studies suggest that tulsi may help regulate blood glucose levels, making it beneficial for people with type 2 diabetes. According to research in the International Journal of Clinical Pharmacology and Therapeutics, tulsi can reduce fasting blood sugar and improve insulin sensitivity. Consuming raw leaves in the morning on an empty stomach may help manage sugar levels. Tulsi helps the body flush out toxins by supporting liver and kidney function. It also contains antioxidants that neutralise free radicals and reduce oxidative stress, promoting overall cellular health. Drinking water infused with raw tulsi leaves is a common detox remedy in many Indian households. Raw tulsi leaves are a natural powerhouse offering preventive and therapeutic health benefits. From boosting immunity and aiding digestion to reducing stress and balancing sugar levels, they support overall wellness without side effects. However, moderation is key, consuming 2-3 leaves daily is sufficient. For those seeking natural ways to enhance health, tulsi could be a small but mighty addition to your routine.   Disclaimer: This content including advice provides generic information only. It is in no way a substitute for a qualified medical opinion. Always consult a specialist or your own doctor for more information. NDTV does not claim responsibility for this information.",2025-05-03 05:10:21,Positive
https://doctor.ndtv.com/living-healthy/natural-detox-remedies-for-smokers-and-alcoholics-8313618,Natural Detox Remedies For Smokers And Alcoholics,"Updated: May 2, 2025 07:18 IST","Tobacco and alcohol use are two of the most common lifestyle choices that negatively impact the body's vital organs, especially the liver, lungs, heart, and kidneys. While quitting is the best option, the recovery and detoxification process can be supported naturally. Detox doesn't mean extreme fasting or relying on fancy juices, it involves helping the body eliminate toxins through the right foods, hydration, herbs, and lifestyle changes. According to the World Health Organisation (WHO), supporting the body's detoxification systems is essential in substance abuse recovery. Here's how smokers and alcohol users can naturally cleanse their systems and boost their overall health. Alcohol and nicotine leave behind a trail of toxins that accumulate in the liver, lungs, and bloodstream. Over time, these can impair organ function, reduce immunity, and increase the risk of chronic diseases. Natural detox methods can help clear these harmful substances, support organ regeneration, and replenish essential nutrients depleted by prolonged smoking and drinking. Let's explore the science behind this fermented favourite. With packed itineraries and limited access to clean facilities, hygiene can often take a back seat. Here are 7 essential hygiene tips to help you stay healthy and safe while travelling. Water is crucial for flushing out toxins. Aim for at least 8–10 glasses a day. You can also drink detoxifying liquids like lemon water, coconut water, or cucumber-infused water. For alcoholics, hydration helps rehydrate the body and supports liver function. Smokers benefit as water helps clear tar and toxins from the lungs. Alcohol and cigarette smoke deplete your body of essential antioxidants like vitamin C, E, and beta-carotene. Include berries, citrus fruits, spinach, beetroot, carrots, and tomatoes in your daily diet. These foods help combat oxidative stress and reduce inflammation caused by toxic exposure. Milk thistle is an age-old herbal remedy known to support liver health. The compound silymarin found in milk thistle has antioxidant and anti-inflammatory properties that help regenerate liver cells. It's especially beneficial for alcohol-related liver damage. Always consult a doctor before adding supplements to your routine. Smokers can benefit from regular steam inhalation with essential oils like eucalyptus or peppermint to clear lung congestion. Additionally, practicing breathing techniques like pranayama or deep diaphragmatic breathing can improve lung capacity and help expel residual toxins. Green tea is rich in catechins and other antioxidants that help boost liver function and remove toxins. Other herbal teas like dandelion root tea, ginger tea, or turmeric tea support digestion, reduce inflammation, and assist detox pathways. Alcohol irritates the gut lining and alters gut flora, while smoking impacts nutrient absorption. Eating fibre-rich foods like oats, whole grains, flaxseeds, and leafy greens can promote healthy bowel movements and support gut detoxification. A healthy gut also supports immunity and mood regulation. Physical activity increases circulation, boosts metabolism, and promotes sweating, a natural detox pathway. Cardio, brisk walking, or yoga help smokers improve lung function and support alcoholics in liver healing. According to the Centres for Disease Control and Prevention (CDC), exercise also helps reduce cravings and improves mental health during recovery. Both smokers and alcohol consumers should reduce intake of processed foods, sugary snacks, and refined carbs. These stress the liver and gut and increase inflammation. Opt instead for clean, home-cooked meals rich in proteins, healthy fats, and whole grains. Quality sleep is the body's natural time for healing. Nicotine and alcohol often disturb sleep cycles, but focusing on 7-8 hours of rest per night helps repair tissues, reset hormones, and support cognitive function during detox. Detoxifying from alcohol and smoking requires patience, consistency, and lifestyle adjustments. While no remedy is a substitute for quitting, these natural strategies can accelerate the body's healing process and reduce the risk of long-term damage. Always consult a healthcare provider when planning a detox, especially if you're undergoing withdrawal or treatment. Your body deserves a fresh start, nourish it well.   Disclaimer: This content including advice provides generic information only. It is in no way a substitute for a qualified medical opinion. Always consult a specialist or your own doctor for more information. NDTV does not claim responsibility for this information.",2025-05-03 05:10:22,Positive
https://doctor.ndtv.com/living-healthy/these-abnormalities-on-your-hands-suggest-these-health-concerns-8313464,These Abnormalities On Your Hands Suggest These Health Concerns,"Updated: May 2, 2025 06:24 IST","Abnormalities on your hands can sometimes suggest underlying health concerns because the skin, nails, joints, and circulation in your hands are closely linked to internal systems like cardiovascular, nervous, metabolic, and immune functions. Subtle changes in color, texture, swelling, or nail shape can be early indicators of conditions like nutrient deficiencies, thyroid disorders, liver disease, or even autoimmune issues. Since the hands are so vascular and visible, they often show signs of internal imbalances sooner than other parts of the body. In this article, we outline various abnormalities of the hands and what they might indicate to.   Consistently cold hands may indicate poor circulation, low thyroid function (hypothyroidism), or Raynaud's disease, a condition that affects blood flow. If your hands stay cold even in warm conditions, it's worth checking your blood pressure and thyroid levels.  Mild hand tremors could be caused by caffeine or stress, but persistent shaking might be linked to neurological issues like Parkinson's disease or essential tremor. It can also signal thyroid overactivity (hyperthyroidism).  When the tips of the fingers swell and nails curve downward, it may point to oxygen deprivation in the blood, often associated with lung diseases, heart conditions, or even liver issues.  Yellow nails might suggest fungal infections, chronic bronchitis, or lymphedema, while pale nails can indicate anaemia. Bluish nails could mean a lack of oxygen in the blood, possibly related to heart or lung disorders.  Swelling in the fingers that doesn't go away may be due to arthritis, kidney disease, or hormonal imbalances. Inflammation and fluid retention can both be signs of internal stress.  Persistent rashes on the hands can be due to eczema or psoriasis, but they might also be triggered by autoimmune diseases or allergic reactions to medications or foods.  Frequent peeling may signal vitamin B deficiency, especially B3 (niacin) or B7 (biotin), or even dehydration. It can also result from overexposure to harsh soaps and sanitisers, which compromise the skin barrier.  These sensations may suggest nerve compression, such as carpal tunnel syndrome, or more systemic issues like diabetes, which affects nerve health. It could also be a sign of vitamin B12 deficiency.  These could be harmless bruises from trauma, but if unexplained, a dark line under the nail could point to melanoma, a type of skin cancer. It's something that should be evaluated quickly.  A sudden decline in grip strength can be a sign of nerve problems, muscle wasting, or even early rheumatoid arthritis. It can also reflect overall decline in physical health, especially in older adults.  Paying attention to persistent or unusual changes in the hands can help in early detection and timely management of several health conditions.    Disclaimer: This content including advice provides generic information only. It is in no way a substitute for a qualified medical opinion. Always consult a specialist or your own doctor for more information. NDTV does not claim responsibility for this information.",2025-05-03 05:10:22,Positive
https://doctor.ndtv.com/health-supplements/these-supplements-may-be-harming-your-kidneys-8310922,These Supplements May Be Harming Your Kidneys,"Updated: May 2, 2025 01:04 IST","Supplements can be harmful to the kidneys, especially when taken in excess or without proper medical guidance. The kidneys are responsible for filtering waste and toxins from the blood, and certain supplements can overburden this system, leading to damage or worsening existing kidney conditions. Some supplements contain substances that are directly toxic to the kidneys, while others can interfere with medications, alter fluid and electrolyte balance, or contribute to the formation of kidney stones. Read on as we share a list of supplements that might be harming your kidneys.   Vitamin D is essential for bone health and immune function, but excessive intake can raise calcium levels in the blood. This condition, called hypercalcemia, can strain the kidneys and lead to the formation of calcium-based kidney stones. Prolonged high calcium levels may also cause calcification in kidney tissues, impairing their function.  Common among athletes and bodybuilders, creatine is used to enhance muscle performance. However, high doses or prolonged use can stress the kidneys by increasing the amount of creatinine, a waste product that kidneys must filter. In people with existing kidney conditions, creatine can accelerate damage.  Protein is essential, but overconsumption especially through supplements can overwork the kidneys. Excess protein increases the nitrogen load in the blood, which the kidneys must excrete. This can lead to glomerular hyper-filtration and, over time, may contribute to kidney damage, especially in people with underlying kidney disease.  Willow bark and similar herbal supplements contain salicylates, similar to aspirin and other non-steroidal anti-inflammatory drugs (NSAIDs). These can reduce blood flow to the kidneys and interfere with their ability to regulate salt and water balance, potentially leading to acute kidney injury, especially when used frequently or in combination with dehydration.  While vitamin C is water-soluble and generally considered safe, large doses (over 2,000 mg/day) can increase oxalate production in the body. Oxalate can bind with calcium to form crystals, which may accumulate in the kidneys as stones. Chronic overuse of vitamin C supplements has been linked to oxalate nephropathy, a serious kidney condition.  Used for digestive issues and adrenal fatigue, licorice root contains glycyrrhizin, which can lead to elevated blood pressure and low potassium levels, a condition known as hypokalaemia. These effects can strain kidney function, especially in people with pre-existing heart or kidney conditions. Chronic use has been associated with fluid retention and electrolyte imbalances that impair renal health.  While magnesium is vital for muscle and nerve function, taking too much, especially in supplement form can be harmful, particularly in people with reduced kidney function. Healthy kidneys usually excrete excess magnesium, but when they are impaired, magnesium can accumulate in the body, causing symptoms like nausea, low blood pressure, and, in severe cases, kidney toxicity or even cardiac arrest.  Even healthy individuals may be at risk if they use high doses over a prolonged period or combine multiple supplements without supervision.   Disclaimer: This content including advice provides generic information only. It is in no way a substitute for a qualified medical opinion. Always consult a specialist or your own doctor for more information. NDTV does not claim responsibility for this information.",2025-05-03 05:10:23,Positive
